{
  "$schema": "http://json-schema.org/draft-07/schema#",
  "$id": "https://gendn.paulkinlan-ea.deno.net/schema/conformance.schema.json",
  "title": "gendn immutable conformance suite",
  "description": "Per reference-page conformance contract. Once committed the assertions array is immutable: assertions are never deleted, weakened, or regenerated to go green — you FIX THE PAGE instead. Adding assertions (growing coverage) is allowed. `suiteHash` is the sha256 of the normalized assertions array and lets the validator detect weakening. These are DOC-QUALITY assertions for a reference site; platform-BEHAVIOR belongs to the chrome-platform-showcase conformance contract this page may reference via `cpsFeature`, never forked here.",
  "type": "object",
  "additionalProperties": false,
  "required": [
    "schemaVersion",
    "id",
    "route",
    "identity",
    "milestone",
    "status",
    "immutable",
    "suiteHash",
    "generatedAt",
    "author",
    "assertions"
  ],
  "properties": {
    "schemaVersion": { "type": "integer", "const": 1 },
    "id": {
      "type": "string",
      "description": "Stable page id `v<N>/<slug>` — must equal a published route in the manifest.",
      "pattern": "^v[0-9]+/[a-z0-9-]+$"
    },
    "route": { "type": "string", "pattern": "^/v[0-9]+/[a-z0-9-]+/$" },
    "identity": {
      "type": "string",
      "description": "The chromestatus.com feature id this page documents (invariant #3). Never repoint.",
      "pattern": "^[0-9]+$"
    },
    "milestone": { "type": "integer", "minimum": 1 },
    "status": { "type": "string", "enum": ["built", "stub"] },
    "demo": {
      "type": ["string", "null"],
      "description": "The chrome-platform-showcase route this page embeds/links for its OWN feature, or null."
    },
    "cpsFeature": {
      "type": ["object", "null"],
      "description": "When this page wraps/links a chrome-platform-showcase feature, the canonical CPS identity and its explicitly listed conformance assertions. CPS conformance does not prove native, hardware, permission, backend, or other behavior its suite does not assert; gendn references the listed contract without forking it.",
      "additionalProperties": false,
      "properties": {
        "host": { "type": "string" },
        "route": { "type": "string" },
        "conformanceRoute": {
          "type": ["string", "null"],
          "description": "A live-verified same-feature CPS conformance page, or null when the selected concept has no verified parent breadcrumb/suite. Never guess from the demo pathname."
        },
        "note": { "type": "string" }
      }
    },
    "immutable": { "type": "boolean", "const": true },
    "suiteHash": {
      "type": "string",
      "description": "sha256 (hex) of the normalized assertions array. Recomputed by the validator; a mismatch means the file was hand-edited without regenerating the hash, and a git-baseline diff catches assertion removal/weakening.",
      "pattern": "^[0-9a-f]{64}$"
    },
    "generatedAt": { "type": "string" },
    "author": { "type": "string" },
    "assertions": {
      "type": "array",
      "minItems": 1,
      "items": { "$ref": "#/definitions/assertion" }
    }
  },
  "definitions": {
    "assertion": {
      "type": "object",
      "additionalProperties": false,
      "required": ["id", "category", "describe", "kind", "deviceClass"],
      "properties": {
        "id": { "type": "string", "pattern": "^[a-z0-9-]+$" },
        "category": {
          "type": "string",
          "enum": [
            "identity",
            "route",
            "structure",
            "links",
            "content",
            "interaction",
            "a11y",
            "responsive",
            "runtime",
            "guidance",
            "demo-link"
          ]
        },
        "describe": { "type": "string", "minLength": 3 },
        "kind": {
          "type": "string",
          "enum": [
            "http-status",
            "dom-query",
            "dom-count",
            "dom-text-contains",
            "js-eval",
            "no-console-errors",
            "no-failed-requests",
            "manual-evidenced"
          ]
        },
        "deviceClass": { "type": "string", "enum": ["both", "desktop", "mobile", "n/a"] },
        "test": { "type": "string" },
        "selector": { "type": "string" },
        "expect": { "type": ["string", "number"] },
        "min": { "type": "integer", "minimum": 0 },
        "specSection": { "type": "string" },
        "evidence": {
          "type": "string",
          "description": "Retained REAL evidence for manual-evidenced assertions: screenshot path, console excerpt, note."
        }
      }
    }
  }
}
