{
  "schemaVersion": 1,
  "id": "v150/allow-optional-rounding-parameter-for-polygon",
  "route": "/v150/allow-optional-rounding-parameter-for-polygon/",
  "identity": "6636392944893952",
  "milestone": 150,
  "status": "stub",
  "demo": null,
  "cpsFeature": null,
  "immutable": true,
  "suiteHash": "27c487357b37aee4e5b5e3c12c7eeb4cdf55755462262338e6b3529af61072b9",
  "generatedAt": "2026-07-19T00:00:00Z",
  "author": "gen-conformance/v1 (derived from page metadata)",
  "assertions": [
    {
      "id": "route-resolves",
      "category": "route",
      "describe": "The stable route /v150/allow-optional-rounding-parameter-for-polygon/ responds 200 (durable-demo contract).",
      "kind": "http-status",
      "test": "/v150/allow-optional-rounding-parameter-for-polygon/",
      "expect": 200,
      "deviceClass": "both"
    },
    {
      "id": "chromestatus-identity-link",
      "category": "identity",
      "describe": "Page carries its canonical chromestatus.com/feature/6636392944893952 link — the immutable feature identity (CLAUDE.md invariant #3) and the milestone-150 mapping's self-heal.",
      "kind": "dom-query",
      "selector": "a[href*=\"chromestatus.com/feature/6636392944893952\"]",
      "deviceClass": "both"
    },
    {
      "id": "title-nonempty",
      "category": "structure",
      "describe": "Document has a non-empty <title> for the reference page.",
      "kind": "js-eval",
      "test": "document.title.trim().length > 0",
      "deviceClass": "both"
    },
    {
      "id": "single-h1",
      "category": "structure",
      "describe": "Exactly one <h1> — the API name (listing name), MDN-shaped article heading.",
      "kind": "js-eval",
      "test": "document.querySelectorAll('h1').length === 1",
      "deviceClass": "both"
    },
    {
      "id": "main-landmark",
      "category": "a11y",
      "describe": "A single <main> landmark wraps the article content.",
      "kind": "js-eval",
      "test": "document.querySelectorAll('main').length === 1",
      "deviceClass": "both"
    },
    {
      "id": "stylesheet-linked",
      "category": "structure",
      "describe": "Shared editorial design system /public/styles.css is linked.",
      "kind": "dom-query",
      "selector": "link[rel=\"stylesheet\"][href=\"/public/styles.css\"]",
      "deviceClass": "both"
    },
    {
      "id": "viewport-meta",
      "category": "responsive",
      "describe": "Responsive viewport meta present (width=device-width) for mobile+desktop parity.",
      "kind": "dom-query",
      "selector": "meta[name=\"viewport\"]",
      "deviceClass": "both"
    },
    {
      "id": "crumb-to-release",
      "category": "structure",
      "describe": "Breadcrumb links back to the /v150/ release index.",
      "kind": "dom-query",
      "selector": "a[href=\"/v150/\"]",
      "deviceClass": "both"
    },
    {
      "id": "byline-footer",
      "category": "structure",
      "describe": "Byline footer present (article provenance).",
      "kind": "dom-query",
      "selector": ".byline",
      "deviceClass": "both"
    },
    {
      "id": "external-links-rel-safe",
      "category": "links",
      "describe": "Every target=_blank link carries rel=noopener (no reverse-tabnabbing; MDN-style external link hygiene).",
      "kind": "js-eval",
      "test": "[...document.querySelectorAll('a[target=\"_blank\"]')].every(el => (el.rel||'').includes('noopener'))",
      "deviceClass": "both"
    },
    {
      "id": "no-empty-anchors",
      "category": "links",
      "describe": "No anchor has an empty or placeholder (#) href.",
      "kind": "js-eval",
      "test": "[...document.querySelectorAll('a')].every(el => { const h = el.getAttribute('href'); return h && h !== '#'; })",
      "deviceClass": "both"
    },
    {
      "id": "no-console-errors",
      "category": "runtime",
      "describe": "Page loads with no console errors.",
      "kind": "no-console-errors",
      "deviceClass": "both"
    },
    {
      "id": "no-failed-requests",
      "category": "runtime",
      "describe": "No failed (>=400 / net-error) network requests on load.",
      "kind": "no-failed-requests",
      "deviceClass": "both"
    },
    {
      "id": "no-horizontal-overflow-desktop",
      "category": "responsive",
      "describe": "No unintended horizontal overflow at desktop (1280x800).",
      "kind": "js-eval",
      "test": "document.documentElement.scrollWidth <= (window.innerWidth + 1)",
      "deviceClass": "desktop"
    },
    {
      "id": "no-horizontal-overflow-mobile",
      "category": "responsive",
      "describe": "No unintended horizontal overflow at narrow mobile (360x740, DPR3).",
      "kind": "js-eval",
      "test": "document.documentElement.scrollWidth <= (window.innerWidth + 1)",
      "deviceClass": "mobile"
    },
    {
      "id": "legible-desktop",
      "category": "responsive",
      "describe": "Desktop render is legible, contrast passes WCAG AA, controls/text not clipped (screenshot review).",
      "kind": "manual-evidenced",
      "deviceClass": "desktop"
    },
    {
      "id": "legible-mobile",
      "category": "responsive",
      "describe": "Mobile render is legible with adequate tap targets and no clipped text/controls (screenshot review).",
      "kind": "manual-evidenced",
      "deviceClass": "mobile"
    },
    {
      "id": "h1-matches-listing-name",
      "category": "content",
      "describe": "The <h1> is the chromestatus milestone-listing name for this feature (not the broader detail name) — factual/source fidelity.",
      "kind": "manual-evidenced",
      "deviceClass": "n/a"
    },
    {
      "id": "guidance-consulted",
      "category": "guidance",
      "describe": "Frontend implementation consulted modern-web-guidance for its UI/responsive/a11y topics and applied or justified them (recorded in _questions.json guidanceConsulted).",
      "kind": "manual-evidenced",
      "deviceClass": "n/a"
    },
    {
      "id": "mdn-card-present",
      "category": "structure",
      "describe": "Stub shows the 'documented on MDN' card explaining gendn doesn't duplicate MDN.",
      "kind": "dom-query",
      "selector": ".mdn-card",
      "deviceClass": "both"
    },
    {
      "id": "mdn-outbound-link",
      "category": "links",
      "describe": "Stub links out to the canonical developer.mozilla.org page for the feature.",
      "kind": "js-eval",
      "test": "!!document.querySelector('a[href*=\"developer.mozilla.org/en-US/docs/Web\"]')",
      "deviceClass": "both"
    },
    {
      "id": "mdn-coverage-accurate",
      "category": "content",
      "describe": "The linked MDN page genuinely covers this feature (has Specifications + Browser compat) — accurate 'covered on MDN' claim (source review).",
      "kind": "manual-evidenced",
      "deviceClass": "n/a"
    }
  ]
}
